tipoid;code;name;active
1;21 1 1 1 1;FUNCIONARIOS ELEGIDOS POR ELECCION POLITICA;0
1;21 1 1 1 2;PERSONAL ADMINISTRATIVO NOMBRADO (REGIMEN PUBLICO);0
1;21 1 1 1 3;PERSONAL CON CONTRATO A PLAZO FIJO (REGIMEN LABORAL PUBLICO);0
1;21 1 1 1 4;PERSONAL CON CONTRATO A PLAZO INDETERMINADO (REGIMEN LABORAL PRIVADO);1
1;21 1 1 1 5;PERSONAL CON CONTRATO A PLAZO FIJO (REGIMEN LABORAL PRIVADO);1
1;21 1 1 1 7;FUNCIONARIOS DE ALTA DIRECCIÓN DE LAS ENTIDADES;0
1;21 1 1 1 8;PERSONAL DE LA LEY SERVIR (RÉGIMEN DEL SERVICIO CIVIL);0
1;21 1 1 1 9;PERSONAL DE CONFIANZA (RÉGIMEN LABORAL PÚBLICO);0
1;21 1 1 2 2;ASIGNACION POR GASTOS OPERATIVOS;0
1;21 1 1 2 3;ASIGNACION POR PRODUCTIVIDAD;0
1;21 1 1 2 4;PARTICIPACION DE LOS TRABAJADORES EN LAS UTILIDADES;0
1;21 1 1 2 5;BONIFICACION POR CAMBIO DE RESIDENCIA;0
1;21 1 1 299;OTRAS RETRIBUCIONES Y COMPLEMENTOS;1
1;21 1 3 1 1;PERSONAL NOMBRADO;0
1;21 1 3 1 2;PERSONAL CONTRATADO;0
1;21 1 3 1 3;PERSONAL SERUMS;0
1;21 1 3 1 4;INTERNOS DE MEDICINA Y ODONTOLOGIA;0
1;21 1 3 1 5;PERSONAL POR SERVICIOS COMPLEMENTARIOS DE SALUD;0
1;21 1 3 2 1;PERSONAL NOMBRADO;0
1;21 1 3 2 2;PERSONAL CONTRATADO;0
1;21 1 3 3 1;GUARDIAS HOSPITALARIAS;0
1;21 1 3 3 2;ASIGNACION EXTRAORDINARIA POR TRABAJO ASISTENCIAL;0
1;21 1 3 399;OTRAS RETRIBUCIONES Y COMPLEMENTOS;0
1;21 1 8 1 1;OBREROS PERMANENTES;0
1;21 1 8 2 1;OBREROS CON CONTRATO A PLAZO FIJO;0
1;21 1 9 1 1;GRATIFICACIONES;1
1;21 1 9 1 2;AGUINALDOS;0
1;21 1 9 1 3;BONIFICACION POR ESCOLARIDAD;1
1;21 1 9 2 1;COMPENSACION POR TIEMPO DE SERVICIOS (CTS);1
1;21 1 9 3 1;ASIGNACION POR CUMPLIR 25 O 30 AÑOS;0
1;21 1 9 3 2;BONIFICACION ADICIONAL POR VACACIONES;0
1;21 1 9 3 3;COMPENSACION VACACIONAL (VACACIONES TRUNCAS);1
1;21 1 9 3 4;ASIGNACION POR ENSEÑANZA;0
1;21 1 9 3 5;BONOS DE PRODUCTIVIDAD-CONVENIOS DE ADMINISTRACION POR RESULTADOS;0
1;21 1 9 3 6;BONO POR CRECIMIENTO ECONOMICO;0
1;21 1 9 3 9;ENTREGA ECONÓMICA POR CONCEPTO DE ALIMENTACIÓN;0
1;21 1 9 399;OTRAS OCASIONALES;1
1;21 110 1 1;DIETAS DE DIRECTORIO Y DE ORGANISMOS COLEGIADOS;0
1;21 110 1 2;DIETAS DE REGIDORES Y CONSEJEROS;0
1;21 110 1 3;DIETAS A COLABORADORES EVENTUALES;0
1;21 2 1 1 1;UNIFORME PERSONAL ADMINISTRATIVO;0
1;21 2 1 199;OTRAS RETRIBUCIONES EN ESPECIE;0
1;21 2 1 2 1;MOVILIDAD PARA TRASLADO DE LOS TRABAJADORES;0
1;21 2 1 2 2;GASTOS POR ESTACIONAMIENTO PARA VEHICULOS DEL PERSONAL;0
1;21 2 1 2 3;GASTOS EN INSTALACIONES RECREATIVAS PARA TRABAJADORES Y FAMILIARES;0
1;21 2 1 2 4;GUARDERIAS PARA HIJOS DE TRABAJADORES;0
1;21 2 1 2 5;ENTREGA DE CUPÓN O VALE POR CONCEPTO DE ALIMENTACIÓN;0
1;21 3 1 1 1;APORTES A LOS FONDOS DE SALUD;1
1;21 3 1 1 2;APORTES A LOS FONDOS DE RETIRO;0
1;21 3 1 1 3;APORTES A LOS FONDOS DE PENSIONES;0
1;21 3 1 1 4;APORTES A LOS FONDOS DE VIVIENDA;0
1;21 3 1 1 5;CONTRIBUCIONES A ESSALUD;1
1;21 3 1 1 6;OTRAS CONTRIBUCIONES DEL EMPLEADOR;1
1;21 3 1 1 9;APORTES A LOS FONDOS DE SALUD PARA PENSIONISTAS;0
1;21 3 1 110;APORTES A LOS FONDOS DE PENSIONES PARA PENSIONISTAS;0
1;21 3 1 111;APORTES A LOS FONDOS DE VIVIENDA PARA PENSIONISTAS;0
1;21 3 1 112;CONTRIBUCIONES POR EL SEGURO COMPLEMENTARIO DE TRABAJO DE RIESGO;0
1;22 1 1 1 1;REGIMEN DE PENSIONES DL. 20530;0
1;22 1 1 1 2;SISTEMA NACIONAL DE PENSIONES DL. 19990;0
1;22 1 1 1 3;REGIMEN DE PENSIONES DL. 19846;0
1;22 1 1 199;OTROS REGIMENES DE PENSIONES;0
1;22 1 1 2 1;ESCOLARIDAD, AGUINALDOS Y GRATIFICACIONES;0
1;22 1 1 2 2;BONIFICACION FONAHPU - D.L. 20530;0
1;22 1 1 299;OTROS BENEFICIOS;0
1;22 2 1 1 1;PRESTACIONES DE SALUD;0
1;22 2 1 2 1;SUBSIDIO POR INCAPACIDAD TEMPORAL;0
1;22 2 1 2 2;SUBSIDIO POR MATERNIDAD;0
1;22 2 1 2 3;SUBSIDIO POR LACTANCIA;0
1;22 2 1 299;OTROS BENEFICIOS;0
1;22 2 1 3 1;GASTOS DE SEPELIO Y LUTO DEL PERSONAL ACTIVO;0
1;22 2 1 3 2;GASTOS DE SEPELIO Y LUTO DEL PERSONAL PENSIONISTA;0
1;22 2 1 3 3;SEGURO MEDICO;0
1;22 2 2 1 1;PENSIONES DE GRACIA;0
1;22 2 2 1 2;PENSIONES POR ACCIDENTES DE TRABAJO O VICTIMAS DE TERRORISMO;0
1;22 2 2 1 3;BONOS COMPLEMENTARIOS Y PENSIONES COMPLEMENTARIAS;0
1;22 2 2 199;OTROS SIMILARES;0
1;22 2 3 1 1;ALIMENTOS PARA PROGRAMAS SOCIALES;0
1;22 2 3 199;OTROS BIENES DE APOYO ALIMENTARIO;0
1;22 2 3 3 1;ENTREGA DE MEDICAMENTOS;0
1;22 2 3 399;OTROS BIENES Y SERVICIOS DE ASISTENCIA MEDICA;0
1;22 2 3 4 1;SEGURO MEDICO;0
1;22 2 3 4 2;GASTOS DE SEPELIO Y LUTO DEL PERSONAL ACTIVO;0
1;22 2 3 4 3;GASTOS DE SEPELIO Y LUTO DEL PERSONAL PENSIONISTA;0
1;22 2 39999;OTROS BIENES DE ASISTENCIA SOCIAL;0
1;23 1 1 1 1;ALIMENTOS Y BEBIDAS PARA CONSUMO HUMANO;1
1;23 1 1 1 2;ALIMENTOS Y BEBIDAS PARA CONSUMO ANIMAL;0
1;23 1 2 1 1;VESTUARIO, ACCESORIOS Y PRENDAS DIVERSAS;1
1;23 1 2 1 2;TEXTILES Y ACABADOS TEXTILES;1
1;23 1 2 1 3;CALZADO;1
1;23 1 3 1 1;COMBUSTIBLES Y CARBURANTES;1
1;23 1 3 1 2;GASES;0
1;23 1 3 1 3;LUBRICANTES, GRASAS Y AFINES;1
1;23 1 4 1 1;MUNICIONES,  EXPLOSIVOS Y SIMILARES;0
1;23 1 5 1 1;REPUESTOS Y ACCESORIOS;1
1;23 1 5 1 2;PAPELERIA EN GENERAL, UTILES Y MATERIALES DE OFICINA;1
1;23 1 5 2 1;AGROPECUARIO, GANADERO Y DE JARDINERIA;0
1;23 1 5 3 1;ASEO, LIMPIEZA Y TOCADOR;1
1;23 1 5 3 2;DE COCINA, COMEDOR Y CAFETERIA;0
1;23 1 5 4 1;ELECTRICIDAD, ILUMINACION Y ELECTRONICA;1
1;23 1 59999;OTROS;1
1;23 1 6 1 1;DE VEHICULOS;1
1;23 1 6 1 2;DE COMUNICACIONES Y TELECOMUNICACIONES;1
1;23 1 6 1 3;DE CONSTRUCCION Y MAQUINAS;0
1;23 1 6 1 4;DE SEGURIDAD;1
1;23 1 6 199;OTROS ACCESORIOS Y REPUESTOS;1
1;23 1 7 1 1;ENSERES;0
1;23 1 8 1 1;VACUNAS;0
1;23 1 8 1 2;MEDICAMENTOS;0
1;23 1 8 199;OTROS PRODUCTOS SIMILARES;0
1;23 1 8 2 1;MATERIAL, INSUMOS, INSTRUMENTAL Y ACCESORIOS  MEDICOS, QUIRURGICOS, ODONTOLOGICOS Y DE LABORATORIO;1
1;23 1 9 1 1;LIBROS, TEXTOS Y OTROS MATERIALES IMPRESOS;0
1;23 1 9 1 2;MATERIAL DIDACTICO, ACCESORIOS Y UTILES DE ENSEÑANZA;0
1;23 1 9 199;OTROS MATERIALES DIVERSOS DE ENSEÑANZA;0
1;23 110 1 1;SUMINISTROS DE USO ZOOTECNICO;0
1;23 110 1 2;MATERIAL BIOLOGICO;0
1;23 110 1 3;ANIMALES PARA ESTUDIO;0
1;23 110 1 4;FERTILIZANTES, INSECTICIDAS, FUNGICIDAS Y SIMILARES;0
1;23 110 1 5;SUMINISTROS DE ACCESORIOS Y/O MATERIALES DE USO FORESTAL;0
1;23 110 1 6;PRODUCTOS FARMACEUTICOS DE USO ANIMAL;0
1;23 111 1 1;PARA EDIFICIOS Y ESTRUCTURAS;1
1;23 111 1 2;PARA VEHICULOS;1
1;23 111 1 3;PARA MOBILIARIO Y SIMILARES;1
1;23 111 1 4;PARA MAQUINARIAS Y EQUIPOS;1
1;23 111 1 5;OTROS MATERIALES DE MANTENIMIENTO;1
1;23 111 1 6;MATERIALES DE  ACONDICIONAMIENTO;1
1;23 199 1 1;HERRAMIENTAS;0
1;23 199 1 2;PRODUCTOS QUIMICOS;0
1;23 199 1 3;LIBROS, DIARIOS, REVISTAS Y OTROS BIENES IMPRESOS NO VINCULADOS A ENSEÑANZA;1
1;23 199 1 4;SIMBOLOS, DISTINTIVOS Y CONDECORACIONES;1
1;23 199 199;OTROS BIENES;1
1;23 2 1 1 1;PASAJES Y GASTOS DE TRANSPORTE;1
1;23 2 1 1 2;VIATICOS Y ASIGNACIONES POR COMISION DE SERVICIO;1
1;23 2 1 1 3;VIATICOS Y FLETES POR CAMBIO DE COLOCACION;0
1;23 2 1 199;OTROS GASTOS;1
1;23 2 1 2 1;PASAJES Y GASTOS DE TRANSPORTE;0
1;23 2 1 2 2;VIATICOS Y ASIGNACIONES POR COMISION DE SERVICIO;0
1;23 2 1 2 3;VIATICOS Y FLETES POR CAMBIO DE COLOCACION;0
1;23 2 1 299;OTROS GASTOS;1
1;23 2 2 1 1;SERVICIO DE SUMINISTRO DE ENERGIA ELECTRICA;1
1;23 2 2 1 2;SERVICIO DE AGUA Y DESAGUE;1
1;23 2 2 1 3;SERVICIO DE SUMINISTRO DE GAS;0
1;23 2 2 2 1;SERVICIO DE TELEFONIA MOVIL;1
1;23 2 2 2 2;SERVICIO DE TELEFONIA FIJA;1
1;23 2 2 2 3;SERVICIO DE INTERNET;1
1;23 2 2 3 1;CORREOS Y SERVICIOS DE MENSAJERIA;1
1;23 2 2 399;OTROS SERVICIOS DE COMUNICACION;1
1;23 2 2 4 1;SERVICIO DE PUBLICIDAD;1
1;23 2 2 4 2;OTROS SERVICIOS DE PUBLICIDAD Y DIFUSION;0
1;23 2 2 4 3;SERVICIOS DE IMAGEN INSTITUCIONAL;1
1;23 2 2 4 4;SERVICIO DE IMPRESIONES, ENCUADERNACION Y EMPASTADO;0
1;23 2 2 4 5;PUBLICACIÓN EN EL DIARIO OFICIAL;1
1;23 2 2 5 1;DIFUSIÓN EN EL DIARIO OFICIAL;0
1;23 2 3 1 1;SERVICIOS DE LIMPIEZA E HIGIENE;1
1;23 2 3 1 2;SERVICIOS DE SEGURIDAD Y VIGILANCIA;1
1;23 2 4 1 1;DE EDIFICACIONES, OFICINAS Y ESTRUCTURAS;0
1;23 2 4 1 2;DE CARRETERAS, CAMINOS Y PUENTES;0
1;23 2 4 1 3;DE VEHICULOS;0
1;23 2 4 1 4;DE MOBILIARIO Y SIMILARES;0
1;23 2 4 1 5;DE MAQUINARIAS Y EQUIPOS;0
1;23 2 4 199;DE OTROS BIENES Y ACTIVOS;0
1;23 2 4 2 1;DE EDIFICACIONES, OFICINAS Y ESTRUCTURAS;0
1;23 2 4 3 1;DE CARRETERAS, CAMINOS Y PUENTES  NO CONCESIONADOS;0
1;23 2 4 4 1;GASTOS POR MANTENIMIENTO Y OPERACIÓN (PAMO);0
1;23 2 4 4 2;GASTOS POR COSTO ANUAL DE MANTENIMIENTO (CAM);0
1;23 2 4 4 3;GASTOS POR MANTENIMIENTO DERIVADOS DE INFORMES TÉCNICOS DE MANTENIMIENTO (ITM);0
1;23 2 4 4 4;GASTOS POR MANTENIMIENTO PERIÓDICO INICIAL (PAMPI);0
1;23 2 4 4 5;GASTOS POR MANTENIMIENTO DE EMERGENCIA;0
1;23 2 4 5 1;DE VEHICULOS;1
1;23 2 4 6 1;DE MOBILIARIO Y SIMILARES;1
1;23 2 4 7 1;DE MAQUINARIAS Y EQUIPOS;1
1;23 2 49999;DE OTROS BIENES Y ACTIVOS;1
1;23 2 5 1 1;DE EDIFICIOS Y ESTRUCTURAS;1
1;23 2 5 1 2;DE VEHICULOS;1
1;23 2 5 1 3;DE MOBILIARIO Y SIMILARES;1
1;23 2 5 1 4;DE MAQUINARIAS Y EQUIPOS;1
1;23 2 5 199;DE OTROS BIENES Y ACTIVOS;1
1;23 2 6 1 1;GASTOS LEGALES Y JUDICIALES;1
1;23 2 6 1 2;GASTOS NOTARIALES;1
1;23 2 6 2 1;CARGOS BANCARIOS;1
1;23 2 6 2 2;GASTOS FINANCIEROS POR COMPRA Y VENTA DE TITULOS Y VALORES;0
1;23 2 6 299;OTROS SERVICIOS FINANCIEROS;1
1;23 2 6 3 1;SEGURO DE VIDA;1
1;23 2 6 3 2;SEGURO DE VEHICULOS;1
1;23 2 6 3 3;SEGURO OBLIGATORIO ACCIDENTES DE TRANSITO (SOAT);1
1;23 2 6 3 4;OTROS SEGUROS PERSONALES;0
1;23 2 6 399;OTROS SEGUROS DE  BIENES MUEBLES E INMUEBLES;1
1;23 2 6 4 1;GASTOS POR PRESTACIONES DE SALUD;1
1;23 2 7 1 1;CONSULTORIAS;1
1;23 2 7 1 2;ASESORIAS;1
1;23 2 7 1 3;AUDITORIAS;1
1;23 2 7 1 4;PERFILES DE INVERSION;0
1;23 2 7 1 5;ESTUDIOS E INVESTIGACIONES;1
1;23 2 7 1 6;ESTUDIOS;1
1;23 2 7 1 7;INVESTIGACIONES;1
1;23 2 7 1 8;DISEÑO DE METODOLOGÍAS, REFORMAS Y SIMILARES;1
1;23 2 7 199;OTROS SERVICIOS SIMILARES;0
1;23 2 7 2 1;CONSULTORIAS;1
1;23 2 7 2 2;ASESORIAS;1
1;23 2 7 2 3;AUDITORIAS;1
1;23 2 7 2 4;PERFILES DE INVERSION;0
1;23 2 7 2 5;ESTUDIOS E INVESTIGACIONES;1
1;23 2 7 2 7;SERVICIOS COMPLEMENTARIOS DE SALUD;0
1;23 2 7 2 9;ESTUDIOS;1
1;23 2 7 210;INVESTIGACIONES;1
1;23 2 7 211;DISEÑO DE METODOLOGÍAS, REFORMAS Y SIMILARES;1
1;23 2 7 299;OTROS SERVICIOS SIMILARES;0
1;23 2 7 3 1;REALIZADO POR PERSONAS JURIDICAS;1
1;23 2 7 3 2;REALIZADO POR PERSONAS NATURALES;1
1;23 2 7 4 1;ELABORACION DE PROGRAMAS INFORMATICOS;1
1;23 2 7 4 2;PROCESAMIENTOS DE DATOS;1
1;23 2 7 4 3;SOPORTE TECNICO;1
1;23 2 7 499;OTROS SERVICIOS DE INFORMATICA;1
1;23 2 7 5 1;ESTIPENDIO POR SECIGRA;0
1;23 2 7 5 2;PROPINAS PARA PRACTICANTES;0
1;23 2 7 5 4;ANIMADORAS Y ALFABETIZADORES;0
1;23 2 7 5 5;ALUMNOS DE ESCUELAS MILITARES Y POLICIALES;0
1;23 2 7 5 6;ESTIPENDIO A LOS CANDIDATOS A GERENTES PÚBLICOS;0
1;23 2 7 5 8;CONTRIBUCIONES A LOS SEGUROS DE SALUD;0
1;23 2 7 510;SUBVENCION ADICIONAL DE PRACTICAS PROFESIONALES;0
1;23 2 7 6 1;SERVICIO Y GESTION DE EVALUACION INTERNACIONAL DE PROCESOS;0
1;23 2 7 7 1;SERVICIOS RELACIONADOS CON EL MEDIO AMBIENTE;0
1;23 2 7 7 2;SERVICIO DE REMEDIACION AMBIENTAL;0
1;23 2 7 7 3;SERVICIOS DE EVALUACIONES, CERTIFICACIONES, LICENCIAMIENTO Y SIMILARES VINCULADOS AL MEDIO AMBIENTE;0
1;23 2 7 8 1;SERVICIOS RELACIONADOS CON EL TRATAMIENTO DE AGUA;0
1;23 2 7 9 1;ORGANIZACION Y CONDUCCION DE EVENTOS DEPORTIVOS;0
1;23 2 7 9 2;ORGANIZACION Y CONDUCCION DE EVENTOS RECREACIONALES;0
1;23 2 7 9 3;ORGANIZACION Y CONDUCCION DE ESPECTACULOS;0
1;23 2 7 9 4;AUSPICIO Y PATROCINIO DE EVENTOS CULTURALES Y DE ARTE;0
1;23 2 7 9 5;ORGANIZACION DE EVENTOS CULTURALES;0
1;23 2 7 999;OTROS RELACIONADOS A ORGANIZACION DE EVENTOS;0
1;23 2 710 1;SEMINARIOS ,TALLERES Y SIMILARES ORGANIZADOS POR LA  INSTITUCION;1
1;23 2 710 2;ATENCIONES OFICIALES Y CELEBRACIONES INSTITUCIONALES;1
1;23 2 71099;OTRAS ATENCIONES Y CELEBRACIONES;1
1;23 2 711 1;EMBALAJE Y ALMACENAJE;0
1;23 2 711 2;TRANSPORTE Y TRASLADO DE CARGA, BIENES Y MATERIALES;1
1;23 2 711 3;SERVICIOS RELACIONADOS CON FLORERIA, JARDINERIA Y OTRAS ACTIVIDADES SIMILARES;0
1;23 2 711 4;SERVICIOS DE CALIFICACION DE PENSIONES;0
1;23 2 711 5;SERVICIOS DE ALIMENTACION DE CONSUMO HUMANO;1
1;23 2 711 6;SERVICIO DE IMPRESIONES, ENCUADERNACION Y EMPASTADO;1
1;23 2 71199;SERVICIOS DIVERSOS;1
1;23 2 712 1;LOCACIÓN DE SERVICIOS - FONDO DE APOYO GERENCIAL;1
1;23 2 712 2;LOCACIÓN DE SERVICIOS - PERSONAL ALTAMENTE CALIFICADO;1
1;23 2 712 3;CONTRATACIÓN DE SERVICIOS DE TERCEROS;0
1;23 2 713 5;ASESORÍA Y/O DEFENSA LEGAL PARA SERVIDORES Y EX-SERVIDORES CIVILES;0
1;23 2 713 6;ASESORÍA Y/O DEFENSA LEGAL PARA ENTIDADES PÚBLICAS EN EL MARCO DE CONTROVERSIAS CONTRACTUALES NACIONALES O INTERNACIONALES;1
1;23 2 713 9;SERVICIOS DE AUDITORIAS;1
1;23 2 71398;OTROS SERVICIOS TÉCNICOS Y PROFESIONALES DESARROLLADOS POR PERSONAS JURÍDICAS;1
1;23 2 714 5;ASESORÍA Y/O DEFENSA LEGAL PARA SERVIDORES Y EX-SERVIDORES CIVILES;0
1;23 2 714 6;ASESORÍA Y/O DEFENSA LEGAL PARA ENTIDADES PÚBLICAS EN EL MARCO DE CONTROVERSIAS CONTRACTUALES NACIONALES O INTERNACIONALES;1
1;23 2 71498;OTROS SERVICIOS TÉCNICOS Y PROFESIONALES DESARROLLADOS POR PERSONAS NATURALES;1
1;23 2 8 1 1;CONTRATO ADMINISTRATIVO DE SERVICIOS;1
1;23 2 8 1 2;CONTRIBUCIONES A ESSALUD DE C.A.S.;1
1;23 2 8 1 3;GASTOS VARIABLES Y OCASIONALES DE C.A.S.;1
1;23 2 8 1 4;AGUINALDOS DE C.A.S.;1
1;23 2 8 1 5;VACACIONES TRUNCAS DE C.A.S.;1
1;23 2 8 1 6;ENTREGA DE CUPÓN O VALE POR CONCEPTO DE ALIMENTACIÓN;0
1;23 2 9 1 1;LOCACIÓN DE SERVICIOS REALIZADOS POR PERSONAS NATURALES RELACIONADAS AL ROL DE LA ENTIDAD;0
1;23 210 1 1;PROPINAS A VOLUNTARIOS;0
1;24 1 1 1 1;PAISES DE AMERICA;0
1;24 1 1 1 2;PAISES DE EUROPA;0
1;24 1 1 1 3;PAISES DE AFRICA, ASIA Y OCEANIA;0
1;24 1 1 2 1;AGENCIAS GUBERNAMENTALES DE COOPERACION INTERNACIONAL;0
1;24 1 1 2 2;FONDOS CONTRAVALOR O DE DESARROLLO BINACIONAL;0
1;24 1 2 1 1;A INSTITUCIONES FINANCIERAS INTERNACIONALES;0
1;24 1 2 199;A OTROS ORGANISMOS INTERNACIONALES;0
1;24 1 3 1 1;A OTRAS UNIDADES DEL GOBIERNO NACIONAL;0
1;24 1 3 1 2;A OTRAS UNIDADES DEL GOBIERNO REGIONAL;0
1;24 1 3 1 3;A OTRAS UNIDADES DEL GOBIERNO LOCAL;0
1;24 1 3 1 4;A OTRAS ENTIDADES PUBLICAS;0
1;24 1 3 1 5;A FONDOS PUBLICOS;0
1;24 2 1 1 1;PAISES DE AMERICA;0
1;24 2 1 1 2;PAISES DE EUROPA;0
1;24 2 1 1 3;PAISES DE AFRICA, ASIA Y OCEANIA;0
1;24 2 1 2 1;AGENCIAS GUBERNAMENTALES DE COOPERACION INTERNACIONAL;0
1;24 2 1 2 2;FONDOS CONTRAVALOR O DE DESARROLLO BINACIONAL;0
1;24 2 2 1 1;A INSTITUCIONES FINANCIERAS INTERNACIONALES;0
1;24 2 2 199;A OTROS ORGANISMOS INTERNACIONALES;0
1;24 2 3 1 1;A OTRAS UNIDADES DEL GOBIERNO NACIONAL;0
1;24 2 3 1 2;A OTRAS UNIDADES DEL GOBIERNO REGIONAL;0
1;24 2 3 1 3;A OTRAS UNIDADES DEL GOBIERNO LOCAL;0
1;24 2 3 1 4;A OTRAS ENTIDADES PUBLICAS;0
1;25 1 1 1 1;EMPRESAS PUBLICAS DEL GOBIERNO NACIONAL;0
1;25 1 1 1 2;EMPRESAS PUBLICAS DE LOS GOBIERNOS REGIONALES;0
1;25 1 1 1 3;EMPRESAS PUBLICAS DE LOS GOBIERNOS LOCALES;0
1;25 1 1 2 1;EMPRESAS PUBLICAS DEL GOBIERNO NACIONAL;0
1;25 1 1 2 2;EMPRESAS PUBLICAS DE LOS GOBIERNOS REGIONALES;0
1;25 1 1 2 3;EMPRESAS PUBLICAS DE LOS GOBIERNOS LOCALES;0
1;25 1 2 1 1;A LAS EMPRESAS PRIVADAS NO FINANCIERAS;0
1;25 1 2 2 1;A LAS EMPRESAS PRIVADAS FINANCIERAS;0
1;25 2 1 1 1;A LA IGLESIA;0
1;25 2 1 1 2;A ORGANISMOS NO GUBERNAMENTALES (ONGS);0
1;25 2 1 1 3;A UNIVERSIDADES;0
1;25 2 1 1 4;A FONDOS Y FUNDACIONES;0
1;25 2 1 199;A OTRAS ORGANIZACIONES;0
1;25 2 2 1 1;A LA IGLESIA;0
1;25 2 2 1 2;A ORGANISMOS NO GUBERNAMENTALES (ONGS);0
1;25 2 2 1 3;A UNIVERSIDADES;0
1;25 2 2 1 4;A FONDOS Y FUNDACIONES;0
1;25 2 2 1 5;A FONDOS SOCIALES;0
1;25 2 2 199;A OTRAS ORGANIZACIONES;0
1;25 3 1 1 1;A ESTUDIANTES;0
1;25 3 1 1 2;A INVESTIGADORES CIENTIFICOS;0
1;25 3 1 199;A OTRAS PERSONAS NATURALES;0
1;25 4 1 1 1;IMPUESTOS;0
1;25 4 1 2 1;DERECHOS ADMINISTRATIVOS;0
1;25 4 1 3 1;MULTAS;0
1;25 4 2 1 1;DERECHOS ADMINISTRATIVOS;0
1;25 4 2 2 1;MULTAS;0
1;25 4 3 1 1;IMPUESTOS;0
1;25 4 3 2 1;DERECHOS ADMINISTRATIVOS;0
1;25 4 3 3 1;MULTAS;0
1;25 5 1 1 1;PERSONAL ADMINISTRATIVO;0
1;25 5 1 1 2;PERSONAL DE EDUCACION;0
1;25 5 1 1 3;PERSONAL DE SALUD;0
1;25 5 1 1 4;PERSONAL JUDICIAL;0
1;25 5 1 1 5;DOCENTES UNIVERSITARIOS;0
1;25 5 1 1 6;PERSONAL DIPLOMATICO;0
1;25 5 1 1 7;PERSONAL MILITAR Y POLICIAL;0
1;25 5 1 1 8;PERSONAL OBRERO;0
1;25 5 1 199;OTRO REGIMEN;1
1;25 5 1 2 1;PENSIONISTAS;0
1;25 5 1 3 1;A PERSONAS JURIDICAS;0
1;25 5 1 3 2;A PERSONAS NATURALES;0
1;25 5 2 1 1;INDEMNIZACIONES POR CESES COLECTIVOS;0
1;25 5 2 1 2;PAGOS EN COMPENSACION DE DAÑOS OCASIONADOS POR DESASTRES NATURALES;0
1;25 5 2 1 3;INDEMNIZACIONES POR ACCIDENTES DE TRABAJO O VICTIMAS DE TERRORISMO;0
1;25 5 2 199;OTRAS INDEMNIZACIONES Y COMPENSACIONES;1
1;26 1 1 1 1;COMPRA DE VIVIENDAS RESIDENCIALES;0
1;26 1 2 1 1;COMPRA DE EDIFICIOS ADMINISTRATIVOS;1
1;26 1 2 1 2;COMPRA DE INSTALACIONES EDUCATIVAS;0
1;26 1 2 1 3;COMPRA DE INSTALACIONES MEDICAS;0
1;26 1 2 1 4;COMPRA DE INSTALACIONES SOCIALES Y CULTURALES;0
1;26 1 2 1 5;COMPRA DE CENTROS DE RECLUSION;0
1;26 1 2 1 6;COMPRA DE EDIFICIOS O UNIDADES NO RESIDENCIALES;0
1;26 2 1 1 2;COSTO DE CONSTRUCCION POR CONTRATA;0
1;26 2 1 1 3;COSTO DE CONSTRUCCION POR ADMINISTRACION DIRECTA - PERSONAL;0
1;26 2 1 1 4;COSTO DE CONSTRUCCION POR ADMINISTRACION DIRECTA - BIENES;0
1;26 2 1 1 5;COSTO DE CONSTRUCCION POR ADMINISTRACION DIRECTA - SERVICIOS;0
1;26 2 1 1 6;COSTO DE CONSTRUCCION POR ADMINISTRACION DIRECTA - OTROS;0
1;26 2 2 1 2;COSTO DE CONSTRUCCION POR CONTRATA;0
1;26 2 2 1 3;COSTO DE CONSTRUCCION POR ADMINISTRACION DIRECTA - PERSONAL;0
1;26 2 2 1 4;COSTO DE CONSTRUCCION POR ADMINISTRACION DIRECTA - BIENES;0
1;26 2 2 1 5;COSTO DE CONSTRUCCION POR ADMINISTRACION DIRECTA - SERVICIOS;0
1;26 2 2 1 6;COSTO DE CONSTRUCCION POR ADMINISTRACION DIRECTA - OTROS;0
1;26 2 2 2 2;COSTO DE CONSTRUCCION POR CONTRATA;0
1;26 2 2 2 3;COSTO DE CONSTRUCCION POR ADMINISTRACION DIRECTA - PERSONAL;0
1;26 2 2 2 4;COSTO DE CONSTRUCCION POR ADMINISTRACION DIRECTA - BIENES;0
1;26 2 2 2 5;COSTO DE CONSTRUCCION POR ADMINISTRACION DIRECTA - SERVICIOS;0
1;26 2 2 2 6;COSTO DE CONSTRUCCION POR ADMINISTRACION DIRECTA - OTROS;0
1;26 2 2 3 2;COSTO DE CONSTRUCCION POR CONTRATA;0
1;26 2 2 3 3;COSTO DE CONSTRUCCION POR ADMINISTRACION DIRECTA - PERSONAL;0
1;26 2 2 3 4;COSTO DE CONSTRUCCION POR ADMINISTRACION DIRECTA - BIENES;0
1;26 2 2 3 5;COSTO DE CONSTRUCCION POR ADMINISTRACION DIRECTA - SERVICIOS;0
1;26 2 2 3 6;COSTO DE CONSTRUCCION POR ADMINISTRACION DIRECTA - OTROS;0
1;26 2 2 4 2;COSTO DE CONSTRUCCION POR CONTRATA;0
1;26 2 2 4 3;COSTO DE CONSTRUCCION POR ADMINISTRACION DIRECTA - PERSONAL;0
1;26 2 2 4 4;COSTO DE CONSTRUCCION POR ADMINISTRACION DIRECTA - BIENES;0
1;26 2 2 4 5;COSTO DE CONSTRUCCION POR ADMINISTRACION DIRECTA - SERVICIOS;0
1;26 2 2 4 6;COSTO DE CONSTRUCCION POR ADMINISTRACION DIRECTA - OTROS;0
1;26 2 2 5 1;COSTO DE CONSTRUCCION POR CONTRATA;0
1;26 2 2 5 3;COSTO DE CONSTRUCCION POR ADMINISTRACION DIRECTA - PERSONAL;0
1;26 2 2 5 4;COSTO DE CONSTRUCCION POR ADMINISTRACION DIRECTA - BIENES;0
1;26 2 2 5 5;COSTO DE CONSTRUCCION POR ADMINISTRACION DIRECTA - SERVICIOS;0
1;26 2 2 5 6;COSTO DE CONSTRUCCION POR ADMINISTRACION DIRECTA - OTROS;0
1;26 2 2 6 2;COSTO DE CONSTRUCCION POR CONTRATA;0
1;26 2 2 6 3;COSTO DE CONSTRUCCION POR ADMINISTRACION DIRECTA - PERSONAL;0
1;26 2 2 6 4;COSTO DE CONSTRUCCION POR ADMINISTRACION DIRECTA - BIENES;0
1;26 2 2 6 5;COSTO DE CONSTRUCCION POR ADMINISTRACION DIRECTA - SERVICIOS;0
1;26 2 2 6 6;COSTOS DE CONSTRUCCION POR ADMINISTRACION DIRECTA - OTROS;0
1;26 2 3 1 2;COSTO DE CONSTRUCCION POR CONTRATA;0
1;26 2 3 1 3;COSTO DE CONSTRUCCION POR ADMINISTRACION DIRECTA - PERSONAL;0
1;26 2 3 1 4;COSTO DE CONSTRUCCION POR ADMINISTRACION DIRECTA - BIENES;0
1;26 2 3 1 5;COSTO DE CONSTRUCCION POR ADMINISTRACION DIRECTA - SERVICIOS;0
1;26 2 3 1 6;COSTO DE CONSTRUCCION POR ADMINISTRACION DIRECTA - OTROS;0
1;26 2 3 2 3;COSTO DE CONSTRUCCION POR CONTRATA;0
1;26 2 3 2 4;COSTO DE CONSTRUCCION POR ADMINISTRACION DIRECTA - PERSONAL;0
1;26 2 3 2 5;COSTO DE CONSTRUCCION POR ADMINISTRACION DIRECTA - BIENES;0
1;26 2 3 2 6;COSTO DE CONSTRUCCION POR ADMINISTRACION DIRECTA - SERVICIOS;0
1;26 2 3 2 7;COSTO DE CONSTRUCCION POR ADMINISTRACION DIRECTA - OTROS;0
1;26 2 3 3 3;COSTO DE CONSTRUCCION POR CONTRATA;0
1;26 2 3 3 4;COSTO DE CONSTRUCCION POR ADMINISTRACION DIRECTA - PERSONAL;0
1;26 2 3 3 5;COSTO DE CONSTRUCCION POR ADMINISTRACION DIRECTA - BIENES;0
1;26 2 3 3 6;COSTO DE CONSTRUCCION POR ADMINISTRACION DIRECTA - SERVICIOS;0
1;26 2 3 3 7;COSTO DE CONSTRUCCION POR ADMINISTRACION DIRECTA - OTROS;0
1;26 2 3 4 2;COSTO DE CONSTRUCCION POR CONTRATA;0
1;26 2 3 4 3;COSTO DE CONSTRUCCION POR ADMINISTRACION DIRECTA - PERSONAL;0
1;26 2 3 4 4;COSTO DE CONSTRUCCION POR ADMINISTRACION DIRECTA - BIENES;0
1;26 2 3 4 5;COSTO DE CONSTRUCCION POR ADMINISTRACION DIRECTA - SERVICIOS;0
1;26 2 3 4 6;COSTO DE CONSTRUCCION POR ADMINISTRACION DIRECTA - OTROS;0
1;26 2 3 5 2;COSTO DE CONSTRUCCION POR CONTRATA;0
1;26 2 3 5 3;COSTO DE CONSTRUCCION POR ADMINISTRACION DIRECTA - PERSONAL;0
1;26 2 3 5 4;COSTO DE CONSTRUCCION POR ADMINISTRACION DIRECTA - BIENES;0
1;26 2 3 5 5;COSTO DE CONSTRUCCION POR ADMINISTRACION DIRECTA - SERVICIOS;0
1;26 2 3 5 6;COSTO DE CONSTRUCCION POR ADMINISTRACION DIRECTA - OTROS;0
1;26 2 3 6 2;COSTO DE CONSTRUCCION POR CONTRATA;0
1;26 2 3 6 3;COSTO DE CONSTRUCCION POR ADMINISTRACION DIRECTA - PERSONAL;0
1;26 2 3 6 4;COSTO DE CONSTRUCCION POR ADMINISTRACION DIRECTA - BIENES;0
1;26 2 3 6 5;COSTO DE CONSTRUCCION POR ADMINISTRACION DIRECTA - SERVICIOS;0
1;26 2 3 6 6;COSTO DE CONSTRUCCION POR ADMINISTRACION DIRECTA - OTROS;0
1;26 2 3 7 2;COSTO DE CONSTRUCCION POR CONTRATA;0
1;26 2 3 7 3;COSTO DE CONSTRUCCION POR ADMINISTRACION DIRECTA - PERSONAL;0
1;26 2 3 7 4;COSTO DE CONSTRUCCION POR ADMINISTRACION DIRECTA - BIENES;0
1;26 2 3 7 5;COSTO DE CONSTRUCCION POR ADMINISTRACION DIRECTA - SERVICIOS;0
1;26 2 3 7 6;COSTO DE CONSTRUCCION POR ADMINISTRACION DIRECTA - OTROS;0
1;26 2 399 2;COSTO DE CONSTRUCCION POR CONTRATA;0
1;26 2 399 3;COSTO DE CONSTRUCCION POR ADMINISTRACION DIRECTA - PERSONAL;0
1;26 2 399 4;COSTO DE CONSTRUCCION POR ADMINISTRACION DIRECTA - BIENES;0
1;26 2 399 5;COSTO DE CONSTRUCCION POR ADMINISTRACION DIRECTA - SERVICIOS;0
1;26 2 399 6;COSTO DE CONSTRUCCION POR ADMINISTRACION DIRECTA - OTROS;0
1;26 3 1 1 1;PARA TRANSPORTE TERRESTRE;1
1;26 3 1 1 2;PARA TRANSPORTE AEREO;0
1;26 3 1 1 3;PARA TRANSPORTE ACUATICO;0
1;26 3 2 1 1;MAQUINAS Y EQUIPOS;1
1;26 3 2 1 2;MOBILIARIO;1
1;26 3 2 2 1;MAQUINAS Y EQUIPOS;0
1;26 3 2 2 2;MOBILIARIO;0
1;26 3 2 3 1;EQUIPOS COMPUTACIONALES Y PERIFERICOS;1
1;26 3 2 3 2;EQUIPOS DE COMUNICACIONES PARA REDES INFORMATICAS;1
1;26 3 2 3 3;EQUIPOS DE TELECOMUNICACIONES;1
1;26 3 2 4 1;MOBILIARIO;1
1;26 3 2 4 2;EQUIPOS;1
1;26 3 2 5 1;MOBILIARIO DE USO AGRICOLA Y PESQUERO;0
1;26 3 2 5 2;EQUIPO DE USO AGRICOLA Y PESQUERO;0
1;26 3 2 6 1;EQUIPO DE CULTURA Y ARTE;0
1;26 3 2 6 2;MOBILIARIO DE CULTURA Y ARTE;0
1;26 3 2 7 1;EQUIPO DE DEPORTES Y RECREACION;0
1;26 3 2 7 2;MOBILIARIO DE DEPORTES Y RECREACION;0
1;26 3 2 8 1;MOBILIARIO, EQUIPOS Y APARATOS PARA LA DEFENSA Y LA SEGURIDAD;0
1;26 3 2 8 2;ARMAMENTO EN GENERAL;0
1;26 3 2 9 1;AIRE ACONDICIONADO Y REFRIGERACION;1
1;26 3 2 9 2;ASEO,  LIMPIEZA Y COCINA;1
1;26 3 2 9 3;SEGURIDAD INDUSTRIAL;1
1;26 3 2 9 4;ELECTRICIDAD Y ELECTRONICA;1
1;26 3 2 9 5;EQUIPOS E INSTRUMENTOS DE MEDICION;1
1;26 3 2 9 6;EQUIPOS PARA VEHICULOS;1
1;26 3 2 999;MAQUINARIAS, EQUIPOS Y MOBILIARIOS DE OTRAS INSTALACIONES;0
1;26 4 1 1 1;ADQUISICION DE PIEDRAS Y METALES PRECIOSOS;0
1;26 4 1 1 2;ADQUISICION DE PINTURAS Y ESCULTURAS;0
1;26 4 1 1 3;ADQUISICION DE JOYAS Y ANTIGUEDADES;0
1;26 5 1 1 1;TERRENOS URBANOS;0
1;26 5 1 1 2;TERRENOS RURALES;0
1;26 5 1 1 3;TERRENOS ERIAZOS;0
1;26 6 1 1 1;ANIMALES DE CRIA;0
1;26 6 1 1 2;ANIMALES REPRODUCTORES;0
1;26 6 1 1 3;ANIMALES DE TIRO;0
1;26 6 1 1 4;OTROS ANIMALES;0
1;26 6 1 1 5;ARBOLES FRUTALES;0
1;26 6 1 1 6;VIDES Y ARBUSTOS;0
1;26 6 1 1 7;SEMILLAS Y ALMACIGOS;0
1;26 6 1 1 8;MINAS Y CANTERAS;0
1;26 6 1 199;OTROS BIENES  AGROPECUARIOS, PESQUEROS Y MINEROS;0
1;26 6 1 2 1;LIBROS Y TEXTOS PARA BIBLIOTECAS;0
1;26 6 1 299;OTROS BIENES CULTURALES;0
1;26 6 1 3 1;PATENTES Y MARCAS DE FABRICA;1
1;26 6 1 3 2;SOFTWARES;1
1;26 6 1 399;OTROS ACTIVOS INTANGIBLES;1
1;26 6 19999;OTROS;0
1;26 7 1 2 1;GASTOS POR LA CONTRATACION DE PERSONAL;0
1;26 7 1 2 2;GASTOS POR LA COMPRA DE BIENES;0
1;26 7 1 2 3;GASTOS POR LA CONTRATACION DE SERVICIOS;0
1;26 7 1 3 1;GASTOS POR LA CONTRATACION DE PERSONAL;0
1;26 7 1 3 2;GASTOS POR LA COMPRA DE BIENES;0
1;26 7 1 3 3;GASTOS POR LA CONTRATACION DE SERVICIOS;0
1;26 7 1 4 1;GASTOS POR LA CONTRATACION DE PERSONAL;0
1;26 7 1 4 2;GASTOS POR LA COMPRA DE BIENES;0
1;26 7 1 4 3;GASTOS POR LA CONTRATACION DE SERVICIOS;0
1;26 7 1 5 1;GASTOS POR LA CONTRATACION DE PERSONAL;0
1;26 7 1 5 2;GASTOS POR LA COMPRA DE BIENES;0
1;26 7 1 5 3;GASTOS POR LA CONTRATACION DE SERVICIOS;0
1;26 7 1 6 1;GASTOS POR LA CONTRATACION DE PERSONAL;0
1;26 7 1 6 2;GASTOS POR LA COMPRA DE BIENES;0
1;26 7 1 6 3;GASTOS POR LA CONTRATACION DE SERVICIOS;0
1;26 8 1 2 1;ESTUDIO DE PREINVERSION;0
1;26 8 1 3 1;ELABORACION DE EXPEDIENTES TECNICOS;0
1;26 8 1 4 1;GASTO POR LA CONTRATACION DE PERSONAL;0
1;26 8 1 4 2;GASTO POR LA COMPRA DE BIENES;0
1;26 8 1 4 3;GASTO POR LA CONTRATACION DE SERVICIOS;0
1;26 8 1 4 4;GASTO POR LAUDOS ARBITRALES O SENTENCIAS VINCULADAS A INVERSIONES;0
1;26 8 1 499;OTROS GASTOS;0
1;27 1 1 1 1;PARA FINES EDUCATIVOS;0
1;27 1 1 1 2;PARA FINES AGROPECUARIOS;0
1;27 1 1 1 3;PARA FINES DE VIVIENDA;0
1;27 1 1 199;PARA OTROS FINES;0
1;27 1 2 1 1;BONOS;0
1;27 1 2 1 2;PAGARES;0
1;27 1 2 1 3;LETRAS;0
1;27 1 2 199;OTROS TITULOS Y VALORES;0
1;27 1 3 1 1;DE EMPRESAS;0
1;27 1 3 1 2;DE ORGANISMOS INTERNACIONALES;0
1;27 1 3 199;DE OTROS;0
1;27 1 4 1 1;CONSTITUCION O AUMENTO DE CAPITAL DE EMPRESAS;0
1;27 1 4 199;OTROS;0
1;28 1 1 1 1;DE PAISES DE AMERICA;0
1;28 1 1 1 2;DE PAISES DE EUROPA;0
1;28 1 1 1 3;DE AFRICA, ASIA Y OCEANIA;0
1;28 1 1 2 1;BANCO INTERAMERICANO DE DESARROLLO - BID;0
1;28 1 1 2 2;BANCO MUNDIAL - BIRF;0
1;28 1 1 2 3;FONDO MONETARIO INTERNACIONAL - FMI;0
1;28 1 1 2 4;KREDINTANSTALF FUR WIEDERAUFBAU - KFW;0
1;28 1 1 2 5;CORPORACION ANDINA DE FOMENTO - CAF;0
1;28 1 1 2 6;FONDO INTERNACIONAL DE DESARROLLO AGRICOLA - FIDA;0
1;28 1 1 2 7;BANCO DE COOPERACION INTERNACIONAL DEL JAPON-JBIC;0
1;28 1 1 2 8;AGENCIA ALEMANA DE COOPERACION TECNICA INTERNACIONAL - GIZ;0
1;28 1 1 2 9;AGENCIA DE COOPERACION INTERNACIONAL DEL JAPON - JICA;0
